{
  "appeal_id": "APL-2026-00001",
  "decided_at": "2026-02-22T12:00:00Z",
  "authority": {
    "authority_id": "AUTH-OVS-01",
    "directory_ref": "AUTH-DIR-01"
  },
  "status": "dismissed",
  "rationale": "The appeal was filed outside the allowed window; the receipt indicates a 30-day deadline.",
  "orders": [
    {
      "order_type": "registry_correction",
      "ref": "CRQ-2026-00009",
      "due_by": "2026-03-10"
    }
  ],
  "signature": {
    "alg": "EdDSA",
    "kid": "did:example:oversight#key-1",
    "value": "BASE64URLSIG"
  }
}
